{
  "archive_format": "determa.archive",
  "archive_schema_version": 1,
  "source": {
    "profile_kind": "guarded_scope",
    "profile_claims": [
      "complete_scope_inventory",
      "durable_embedded_processing",
      "guarded_local_writes",
      "safe_relocation",
      "worker_fencing"
    ],
    "profile_digest": "sha256:0d04260771babb9c7d794052ecfa75f6e876ed0b3646422ebfe9b1e4bb69b869",
    "logical_scope_identity": "scope-archive-example",
    "ownership_binding_digest": "sha256:300dbfa84132cddc3451fd5ef8fb5f64ce0b5853991df41461f9bad9b73e56a1",
    "scope_generation": "7"
  },
  "participant_contract": {
    "required_participant_ids": [
      "helper-state"
    ],
    "optional_participant_ids": [],
    "participant_contract_digest": "sha256:a8cd5a9575ca73028e2fb3014987d4e04bd0679250d0d82658376533f283646e"
  },
  "selection": {
    "root_instance_ids": [
      "effect-1",
      "fault-1",
      "job-42",
      "server-1"
    ],
    "consistency_token": "capture-7"
  },
  "checkpoints": [
    {
      "execution_checkpoint_format": "determa.execution_checkpoint",
      "execution_checkpoint_schema_version": 1,
      "root_instance_id": "effect-1",
      "revision": "4",
      "root_record": {
        "status": "retained",
        "aggregate_state": {
          "aggregate_state_format": "determa.aggregate_state",
          "aggregate_state_schema_version": 1,
          "machine_format": 1,
          "validated_bundle_fingerprint": "sha256:69614f5c10828364f93960fa5347d212750e67f0c37b8056d8fd0966e334c74f",
          "namespace": "example.archive_effects",
          "root_machine_id": "effects",
          "root_machine_version": "1",
          "root_instance_id": "effect-1",
          "creation_id": "create-effect-1",
          "root_runtime_id": "sha256:b37c524b9e24c7657a253253ab483e84b15feb65cfca1a66d37f58a8fc1bc23d",
          "migration_sequence": "0",
          "next_logical_step_sequence": "1",
          "next_output_sequence": "3",
          "next_acceptance_sequence": "0",
          "next_queue_sequence": "0",
          "runtimes": [
            {
              "runtime_id": "sha256:b37c524b9e24c7657a253253ab483e84b15feb65cfca1a66d37f58a8fc1bc23d",
              "identity_origin": {
                "kind": "root",
                "definition": {
                  "validated_bundle_fingerprint": "sha256:69614f5c10828364f93960fa5347d212750e67f0c37b8056d8fd0966e334c74f",
                  "machine": {
                    "namespace": "example.archive_effects",
                    "machine_id": "effects",
                    "machine_version": "1",
                    "root_definition_pointer": "/machines/0/root"
                  }
                },
                "root_instance_id": "effect-1"
              },
              "target_identity": {
                "root": {
                  "root_instance_id": "effect-1",
                  "root_runtime_id": "sha256:b37c524b9e24c7657a253253ab483e84b15feb65cfca1a66d37f58a8fc1bc23d"
                }
              },
              "current_definition": {
                "validated_bundle_fingerprint": "sha256:69614f5c10828364f93960fa5347d212750e67f0c37b8056d8fd0966e334c74f",
                "machine": {
                  "namespace": "example.archive_effects",
                  "machine_id": "effects",
                  "machine_version": "1",
                  "root_definition_pointer": "/machines/0/root"
                }
              },
              "relation": {
                "kind": "root"
              },
              "status": "running",
              "active_leaf_state_definition_pointers": [
                "/machines/0/root"
              ],
              "active_state_activations": [
                {
                  "state_definition_pointer": "/machines/0/root",
                  "activation_sequence": "0"
                }
              ],
              "variables": [],
              "history": [],
              "next_spawn_sequence": "0",
              "next_state_activation_sequences": [
                {
                  "definition_pointer": "/machines/0/root",
                  "next_sequence": "1"
                }
              ],
              "next_component_activation_sequences": [],
              "ready_mailbox": [],
              "deferred_mailbox": [],
              "fault": null
            }
          ],
          "aggregate_state_digest": "sha256:980d8c2ffdc7264768c480e3ab36e7f6a0bb6105d7ef10302c29ce85bb25074d"
        }
      },
      "replay_retention": {
        "mode": "permanent",
        "permanent_replay_eligible": true,
        "pruned_through_receipt_sequence": null,
        "policy_identifier": null
      },
      "next_operation_receipt_sequence": "1",
      "operation_receipts": [
        {
          "operation_kind": "creation",
          "receipt_sequence": "0",
          "creation_id": "create-effect-1",
          "request_digest": "sha256:b9749908aaf173cda745167936c23cdcda723de70ed583627d98d90e495eea16",
          "committed_revision": "0",
          "resulting_aggregate_state_digest": "sha256:980d8c2ffdc7264768c480e3ab36e7f6a0bb6105d7ef10302c29ce85bb25074d",
          "status": "running",
          "fault": null,
          "emission_references": [
            {
              "kind": "external_outbox",
              "emission_index": "0",
              "effect_id": "sha256:fe78520c0ca9460e6292f33c30c022e5ec0f62e74a2143f9121241b777b89209"
            },
            {
              "kind": "external_outbox",
              "emission_index": "0",
              "effect_id": "sha256:7385a8ba000dfadd94d5f30e2fb1e765229e815603479f3539f7245f37e3ad7d"
            },
            {
              "kind": "external_outbox",
              "emission_index": "0",
              "effect_id": "sha256:ca805923f4306de41157b41fd7a28924a3fc44a1b1750d48f610f9926a737a56"
            }
          ]
        }
      ],
      "event_identity_tombstones": [],
      "pending_outbox_intents": [
        {
          "intent": {
            "effect_id": "sha256:fe78520c0ca9460e6292f33c30c022e5ec0f62e74a2143f9121241b777b89209",
            "sequence": "0",
            "event": "pending_notice",
            "payload": [
              "map",
              []
            ],
            "correlation_id": "corr-0"
          },
          "state_revision": "4",
          "delivery_state": {
            "status": "ambiguous",
            "reason_code": "unknown_confirmation"
          }
        }
      ],
      "next_outbox_terminal_sequence": "2",
      "terminal_outbox_records": [
        {
          "terminal_sequence": "0",
          "intent": {
            "effect_id": "sha256:7385a8ba000dfadd94d5f30e2fb1e765229e815603479f3539f7245f37e3ad7d",
            "sequence": "1",
            "event": "terminal_notice",
            "payload": [
              "map",
              []
            ],
            "correlation_id": "corr-1"
          },
          "committed_revision": "1",
          "outcome": {
            "status": "confirmed"
          }
        }
      ],
      "outbox_effect_tombstones": [
        {
          "terminal_sequence": "1",
          "effect_id": "sha256:ca805923f4306de41157b41fd7a28924a3fc44a1b1750d48f610f9926a737a56",
          "intent_digest": "sha256:528e0033d2b7de611e1c5797ef2a6a943d84057a5a6bd6a75a29e87622d2845c",
          "committed_revision": "2",
          "outcome": {
            "status": "dead_lettered",
            "reason_code": "policy"
          }
        }
      ],
      "migration_audit_records": [],
      "execution_checkpoint_digest": "sha256:5667b9609eaf93f15abbd803110b46fb291f2e1b842f35ab2541387213fc1f8b"
    },
    {
      "execution_checkpoint_format": "determa.execution_checkpoint",
      "execution_checkpoint_schema_version": 1,
      "root_instance_id": "fault-1",
      "revision": "2",
      "root_record": {
        "status": "retained",
        "aggregate_state": {
          "aggregate_state_format": "determa.aggregate_state",
          "aggregate_state_schema_version": 1,
          "machine_format": 1,
          "validated_bundle_fingerprint": "sha256:d9c63e89dac38aedbd3d439a9049158d39e8f3791dd55f7856540f684d16ffcc",
          "namespace": "example.transaction_server",
          "root_machine_id": "transaction_server",
          "root_machine_version": "1",
          "root_instance_id": "fault-1",
          "creation_id": "create-fault-1",
          "root_runtime_id": "sha256:b11138f6570635b03603a5518928c7ecc62105a7cd6b0d3d915593d7eb7ef321",
          "migration_sequence": "0",
          "next_logical_step_sequence": "2",
          "next_output_sequence": "0",
          "next_acceptance_sequence": "1",
          "next_queue_sequence": "1",
          "runtimes": [
            {
              "runtime_id": "sha256:b11138f6570635b03603a5518928c7ecc62105a7cd6b0d3d915593d7eb7ef321",
              "identity_origin": {
                "kind": "root",
                "definition": {
                  "validated_bundle_fingerprint": "sha256:d9c63e89dac38aedbd3d439a9049158d39e8f3791dd55f7856540f684d16ffcc",
                  "machine": {
                    "namespace": "example.transaction_server",
                    "machine_id": "transaction_server",
                    "machine_version": "1",
                    "root_definition_pointer": "/machines/0/root"
                  }
                },
                "root_instance_id": "fault-1"
              },
              "target_identity": {
                "root": {
                  "root_instance_id": "fault-1",
                  "root_runtime_id": "sha256:b11138f6570635b03603a5518928c7ecc62105a7cd6b0d3d915593d7eb7ef321"
                }
              },
              "current_definition": {
                "validated_bundle_fingerprint": "sha256:d9c63e89dac38aedbd3d439a9049158d39e8f3791dd55f7856540f684d16ffcc",
                "machine": {
                  "namespace": "example.transaction_server",